waniskâw __ V __ IA __ rise, get up __ HUMAN_V __ 
micisiw __ V __ IA __ eat __ HUMAN_V __ 
nohtehkatew __ V __ IA __ be hungry __ HUMAN_V, mACTIVITY __ 
atoskêw __ V __ IA __ work __ HUMAN_V, mACTIVITY __ 
akwahow __ V __ IA __ to cover oneself __ HUMAN_V __ 
nêhiyawêw __ V __ IA __ work __ HUMAN_V, mACTIVITY __ 
kiskinohamâkosi __ V __ IA __ learn __ HUMAN_V __ 
itamahciho __ V __ IA __ feel __ HUMAN_V __ 
miyomahciho __ V __ IA __ feel good __ HUMAN_V, mACTIVITY __ 
nestosi __ V __ IA __ be tired __ HUMAN_V, mACTIVITY __ 
nohtekate __ V __ IA __ be hungry __ HUMAN_V, mACTIVITY __ 
nohtekwasi __ V __ IA __ be sleepy __ HUMAN_V, mACTIVITY __ 
wâpiskisiw __ V __ IA __ be white __ ANIMAL_V __ 
kaskitêsiw __ V __ IA __ be black __ ANIMAL_V __ 
kaskitêwinâkosiw __ V __ IA __ appear blac __ ANIMAL_V __ 
mihkosiw __ V __ IA __ be red __ ANIMAL_V __ 
sîpihkosiw __ V __ IA __ be blue __ ANIMAL_V __ 
askitahkosiw __ V __ IA __ be green __ ANIMAL_V __ 
wâposâwisiw __ V __ IA __ be yellow __ ANIMAL_V __ 
osâwisiw __ V __ IA __ be orange __ ANIMAL_V __ 
nîpâmâyâtisiw __ V __ IA __ be purple __ ANIMAL_V __ 
wâpinâkosiw __ V __ IA __ appear white __ ANIMAL_V __ 
itasinâsw __ V __ IA __ what colour is __ FURNITURE, CLOTHING __ 
pêtawêw __ V __ TA __ s/he brings it to for AN __ HUMAN_V __ I1
wîkiw __ V __ AI __ s/he lives at, he lives at, she lives at __ HUMAN_V __ I4
atoskêw __ V __ AI __ s/he works, she works, he works, works __ HUMAN_V __ I4
itohtêw __ V __ AI __ s/he goes, she goes, he goes __ HUMAN_V __ I4
isiyihkâsow __ V __ AI __ s/he is named, she is named, he is named, s/he is called, she is called, he is called __ x __ I4
isiyihkâcikâtêw (isîyihkâtew) __ V __ II __ it is named __ x __ I4
isîyihkâta? __ V __ TI __ s/he names IN, he names IN, she names IN __ x __ I4
isîyihkâs? __ V __ TA __ s/he names AN, he names AN, she names AN __ x __ I4
wâpamêw __ V __ TA __ s/he sees AN, he sees AN, she sees AN __ x __ I4
wâpahtam __ V __ TI __ s/he sees IN __ x __ I4
nitawêyimêw __ V __ TA __ s/he wants AN, she wants AN, he wants AN __ x __ I4
nitaweyihta? __ V __ TI __ s/he wants IN, she wants IN, he wants IN __ x __ I4
nistaweyim? __ V __ TA __ s/he knows AN, she knows AN, he knows AN __ x __ I4
pîkiskwâs? __ V __ TA __ s/he talks to AN, she talks to AN, he talks to AN __ x __ I4
itwêw __ V __ TI __ s/he says it, she says it, he says it, s/he says IN, she says IN, he says IN, __ x __ I4
kiskinohamâkosi? __ V __ AI __ s/he learns, he learns, she learns __ x __ I5
nisitohta __ V __ TI __ s/he understands NI, she understands NI, he understands NI, s/he understands it, she understands it, he understands it __ x __ I5
nêhiyawêw __ V __ AI __ s/he speaks Cree, she speaks Cree, he speaks Cree __ x __ I5
itamahcihow __ V __ AI __ s/he feels such, he feels such, she feels such __ x __ I5
miyomahcihow __ V __ AI __ s/he feels good, he feels good, she feels good __ x __ I5
nêstosiw __ V __ AI __ s/he is tired, he is tired, she is tired __ x __ I5
nohtekate? __ V __ AI __ s/he is hungry, he is hungry, she is hungry __ x __ I5
nohtekwasi? __ V __ AI __ s/he is sleepy, he is sleepy, she is sleepy __ x __ I5
nitohta __ V __ TI __ s/he listens to IN, he listens to IN, she listens to IN, s/he listens to it, he listens to it, she listens to it __ x __ I5
mihkosiw __ V __ AI __ s/he is red, he is red, she is red __ x __ I6
mihkwâw __ V __ II __ it is red, IN is red __ x __ I6
kaskitêsiw __ V __ AI __ s/he is black, he is black, she is black __ x __ I6
kaskitewâw? __ V __ II __ it is black, IN is black __ x __ I6
wâpiskisiw __ V __ AI __ s/he is white, he is white, she is white __ x __ I6
wâpiskâw? __ V __ II __ it is white, IN is white __ x __ I6
askihtakosiw __ V __ AI __ s/he is green, he is green, she is green __ x __ I6
askihtakwâw? __ V __ II __ it is green, IN is green __ x __ I6
sîpihkosiw __ V __ AI __ s/he is blue, he is blue, she is blue __ x __ I6
sîpihkwâw? __ V __ II __ it is blue, IN is blue __ x __ I6
wâposâwisiw __ V __ AI __ s/he is yellow, he is yellow, she is yellow __ x __ I6
wâpasâwâw? __ V __ II __ it is yellow, IN is yellow __ x __ I6
miyosiw __ V __ AI __ s/he is nice, he is nice, she is nice __ x __ I6
miywâsin __ V __ II __ it is red, IN is red __ x __ I6
katawasisiw __ V __ AI __ s/he is beautiful, he is beautiful, she is beautiful __ x __ I6
katawasisin? __ V __ II __ it is beautiful, IN is beautiful __ x __ I6
misikitiw __ V __ AI __ s/he is big, he is big, she is big, s/he is large, he is large, she is large __ x __ I6
misâw? __ V __ II __ it is big, IN is big, it is large, IN is large __ x __ I6
kakwêyâhow __ V __ AI __ s/he is fast, he is fast, she is fast __ x __ I6
kakweyâhômakan? __ V __ II __ it is fast, IN is fast __ x __ I6
apisîsisiw __ V __ AI __ s/he is small, he is small, she is small __ x __ I6
apisâsin __ V __ II __ it is small, IN is small __ x __ I6
maskawisîw __ V __ AI __ s/he is strong, he is strong, she is strong __ x __ I6
maskawisîmakan __ V __ II __ it is strong, IN is strong __ x __ I6
wîhkitisiw __ V __ AI __ s/he is delicious, he is delicious, she is delicious __ x __ I6
wihkasin? __ V __ II __ it is delicious, IN is delicious __ x __ I6
wihkistew? __ V __ TA __ s/he likes the taste of AN, he likes the taste of AN, she likes the taste of AN __ x __ I6
wihkistam __ V __ TI __ s/he likes the taste of it, he likes the taste of it, she likes the taste of it, s/he likes the taste of IN, he likes the taste of IN, she likes the taste of IN __ x __ I6
osâwisiw __ V __ AI __ s/he is orange, he is orange, she is orange, s/he is light brown, he is light brown, she is light brown __ x __ I6
osâwâw? __ V __ II __ it is orange, IN is orange, it is light brown, IN is light brown __ x __ I6
wîpôsâwisiw? __ V __ AI __ s/he is brown, he is brown, she is brown __ x __ I6
wîpôsâwâw? __ V __ II __ it is brown, IN is brown __ x __ I6
wâpikwanîwinâkosiw __ V __ AI __ s/he is pink, he is pink, she is pink __ x __ I6
wâpikwanîwinâkwan? __ V __ II __ it is pink, IN is pink __ x __ I6
wîpisîpihkosiw? __ V __ AI __ s/he is purple, he is purple, she is purple __ x __ I6
wîpisîpihkwâw? __ V __ II __ it is purple, IN is purple __ x __ I6
watôkimihkosiw? __ V __ AI __ s/he is wine red, he is wine red, she is wine red, s/he is wine colour, he is wine colour, she is wine colour __ x __ I6
watôkimihkwâw? __ V __ II __ it is wine red, IN is wine red, it is wine colour, IN is wine colour __ x __ I6
pihkonâkosiw __ V __ AI __ s/he is gray, he is gray, she is gray __ x __ I6
pihkonâkwan? __ V __ II __ it is gray, IN is gray __ x __ I6
kinosiw __ V __ AI __ s/he is tall, he is tall, she is tall __ x __ I6
kinwâw? __ V __ II __ it is tall, IN is tall __ x __ I6
ispâw __ V __ II __ it is high, IN is high __ x __ I6
cimisisiw __ V __ AI __ s/he is short, he is short, she is short __ x __ I6
cimâsin? __ V __ II __ it is short, IN is short __ x __ I6
mâyâtisiw __ V __ AI __ s/he is ugly, he is ugly, she is ugly __ x __ I6
mâyâtan __ V __ II __ it is ugly, IN is ugly __ x __ I6
yîkicikâwîw __ V __ AI __ s/he is slow, he is slow, she is slow __ x __ I6
yikicikâwîmakan? __ V __ II __ it is slow, IN is slow __ x __ I6
wîyipâtisiw? __ V __ AI __ s/he is dirty, he is dirty, she is dirty, AN is dirty __ x __ I6
wîyipâtan? __ V __ II __ it is dirty, IN is dirty __ x __ I6
pîkopayiw __ V __ AI __ AN is broken, s/he is broken, he is broken, she is broken __ x __ I6
pîkopayin? __ V __ II __ it is broken, IN is broken, it is torn, IN is torn __ x __ I6
kanâtisiw __ V __ AI __ s/he is clean, he is clean, she is clean, AN is clean __ x __ I6
kanâtan? __ V __ II __ it is clean, IN is clean __ x __ I6
pôsiw __ V __ AI __ s/he rides, he rides, she rides __ x __ I7
pôsihêw __ V __ TA __ s/he gives a ride to AN, he gives a ride to AN, she gives a ride to AN __ x __ I7
têhtapiw __ V __ TI __ s/he sits on something, he sits on something, she sits on something, s/he rides a horse, he rides a horse, she rides a horse __ x __ I7
itâpiw __ V __ AI __ s/he looks, he looks, she looks __ x __ I7
kitâpahta? __ V __ TI __ s/he looks at IN, he looks at IN, she looks at IN __ x __ I7
kitâpamêw __ V __ TA __ s/he looks at AN, he looks at AN, she looks at AN __ x __ I7
pâhpisiw __ V __ AI __ s/he smiles, he smiles, she smiles __ x __ I7
waskawîw __ V __ AI __ s/he waskawîw, he waskawîw, she waskawîw __ x __ I7
mow __ V __ TA __ s/he eats AN, he eats AN, she eats AN __ x __ I7
mîci __ V __ TI __ s/he eats IN, he eats IN, she eats IN __ x __ I7
pakamaha? __ V __ TI __ s/he hits IN, he hits IN, she hits IN __ x __ I7
pakamah? __ V __ TA __ s/he hits AN, he hits AN, she hits AN __ x __ I7
piminawasow __ V __ AI __ s/he cooks, he cooks, she cooks __ x __ I7
nawacîw? __ V __ TI __ s/he bakes something, he bakes something, she bakes something __ x __ I7
nawacîw? __ V __ TA __ s/he bakes something, he bakes something, she bakes something __ x __ I7
kîsisa? __ V __ TI __ s/he cooks IN, he cooks IN, she cooks IN __ x __ I7
kîsis __ V __ TA __ s/he cooks AN, he cooks AN, she cooks AN __ x __ I7
waniskâw __ V __ AI __ s/he gets up from bed, he gets up from bed, she gets up from bed __ x __ I7
pasikôw __ V __ AI __ s/he gets up, he gets up, she gets up __ x __ I7
wayawîw __ V __ AI __ s/he goes outside, he goes outside, she goes outside __ x __ I7
sipwêhtêw __ V __ AI __ s/he leaves, he leaves, she leaves __ x __ I7
ayapi? __ V __ AI __ s/he sits down, he sits down, she sits down, s/he is at home, he is at home, she is at home __ x __ I7
ayâ? __ V __ TI __ s/he has IN, he has IN, she has IN __ x __ I7
ayâwêw __ V __ TA __ s/he has AN, he has AN, she has AN __ x __ I7
sâmina? __ V __ TI __ s/he touches IN, he touches IN, she touches IN __ x __ I7
sâminêw __ V __ TA __ s/he touches AN, he touches AN, she touches AN __ x __ I7
pôtâta? __ V __ TI __ s/he blows on IN, he blows on IN, she blows on IN __ x __ I7
pôtâs? __ V __ TA __ s/he blows on AN, he blows on AN, she blows on AN __ x __ I7
miyweyihta? __ V __ AI __ s/he likes NI, he likes NI, she likes NI __ x __ I7
pêhtawêw __ V __ TA __ s/he hears AN, he hears AN, she hears AN __ x __ I7
nisitohtawêw __ V __ TA __ s/he understands AN, he understands AN, she understands AN __ x __ I7
nisitawêyimêw __ V __ TA __ s/he knows AN, he knows AN, she knows AN __ x __ I7
pêhow __ V __ AI __ s/he waits, he waits, she waits __ x __ I8
akihcikêw __ V __ AI __ s/he counts, he counts, she counts __ x __ I8
akihta? __ V __ TI __ s/he counts IN, he counts IN, she counts IN __ x __ I8
akimêw __ V __ TA __ s/he counts AN, he counts AN, she counts AN __ x __ I8
âpihtâkîsikâw? __ V __ II __ it is noon __ x __ I8
âpihtâtipiskâw __ V __ II __ it is midnight __ x __ I8
kîsikâw? __ V __ II __ it is day __ x __ I8
tipiskâw? __ V __ II __ it is night __ x __ I8
wâpan? __ V __ II __ it is dawn __ x __ I8
petâpan? __ V __ II __ it is dawn __ x __ I8
otâkosin? __ V __ II __ it is evening __ x __ I8
kîkisepâyâw? __ V __ II __ it is morning __ x __ I8
ayami'hew'kîsikâw? __ V __ II __ it is Sunday __ x __ I9
pônâyamihew'kîsikâw? __ V __ II __ it is Monday __ x __ I9
nîsokîsikâw? __ V __ II __ it is Tuesday __ x __ I9
nistokîsikâw? __ V __ II __ it is Wednesday __ x __ I9
newokîsikâw? __ V __ II __ it is Thursday __ x __ I9
nîyânanokîsikâw? __ V __ II __ it is Friday __ x __ I9
nikotwâsik kîsikâw? __ V __ II __ it is Saturday __ x __ I9
itakihtew? __ V __ II __ IN costs __ x __ I9
itakisow __ V __ II __ AN costs __ x __ I9
itahtopiponêw __ V __ AI __ s/he is years old, he is years old, she is years old __ x __ I9
isiwepan? __ V __ II __ weather is, weather is like __ x __ I9
wâsêskwan __ V __ II __ the sky is clear __ x __ I9
kâcitina? __ V __ TI __ s/he receives IN, he receives IN, she receives IN, s/he gets IN, he gets IN, she gets IN, __ x __ I9
sôniyâhkêw __ V __ AI __ s/he earns money, he earns money, she earns money, s/he makes money, he makes money, she makes money __ x __ I9
otahôwe? __ V __ AI __ s/he wins, he wins, she wins __ x __ I9
kocîw __ V __ AI __ s/he tries, he tries, she tries __ x __ I10
kocihtâ? __ V __ TI __ s/he tries IN, he tries IN, she tries IN __ x __ I10
kocîhêw __ V __ TA __ s/he tries AN, he tries AN, she tries AN __ x __ I10
petâ? __ V __ TI __ s/he brings IN, he brings IN, she brings IN __ x __ I10
pêsiwêw __ V __ TA __ s/he brings AN, he brings AN, she brings AN __ x __ I10
nâta? __ V __ TI __ s/he gets IN, he gets IN, she gets IN __ x __ I10
nâs? __ V __ TA __ s/he gets AN, he gets AN, she gets AN __ x __ I10
âkayâsîmow __ V __ AI __ s/he speaks English, he speaks English, she speaks English __ x __ I11
ayamihâw __ V __ AI __ s/he prays, he prays, she prays __ x __ I11
pimipahtâw __ V __ AI __ s/he runs, he runs, she runs __ x __ I11
têpwêw __ V __ AI __ s/he calls, he calls, she calls, s/he shouts, he shouts, she shouts __ x __ I11
otinêw __ V __ TA __ s/he picks up AN, he picks up AN, she picks up AN, s/he takes up AN, he takes up AN, she takes up AN __ x __ I12
otina? __ V __ TI __ s/he picks up IN, he picks up IN, she picks up IN, s/he takes up IN, he takes up IN, she takes up IN __ x __ I12
itohtahêw __ V __ TA __ s/he takes AN to a certain location over distance, he takes AN to a certain location over distance, she takes AN to a certain location over distance __ x __ I12
itohtatâ? __ V __ TI __ s/he takes IN to a certain location over distance, he takes IN to a certain location over distance, she takes IN to a certain location over distance __ x __ I12
naskwênêw __ V __ TA __ s/he picks up AN over distance, he picks up AN over distance, she picks up AN over distance __ x __ I12
naskwena? __ V __ TI __ s/he picks up IN over distance, he picks up IN over distance, she picks up IN over distance __ x __ I12
tahkonêw __ V __ TA __ s/he carries AN, he carries AN, she carries AN __ x __ I12
tahkona? __ V __ TI __ s/he carries IN, he carries IN, she carries IN __ x __ I12
pîkonêw __ V __ TA __ s/he breaks AN, he breaks AN, she breaks AN __ x __ I12
pîkona? __ V __ TI __ s/he breaks IN, he breaks IN, she breaks IN __ x __ I12
nakas? __ V __ TA __ s/he leaves AN, he leaves AN, she leaves AN __ x __ I12
nakata? __ V __ TI __ s/he leaves IN, he leaves IN, she leaves IN __ x __ I12
ahi? __ V __ TA __ s/he puts down AN, he puts down AN, she puts down AN, s/he sets down AN, he sets down AN, she sets down AN __ x __ I12
astâ? __ V __ TI __ s/he puts down IN, he puts down IN, she puts down IN, s/he sets down IN, he sets down IN, she sets down IN __ x __ I12
