Target language lemma,ID,User language gloss,English gloss,POS,Level,Word source,Ex. ID,Form,Analysis,Target language example sentence,User language translation,English translation,Reference,Topic(s),Lesson
viessu,,hus,,N,A1,,,viesu,Sg.Acc,Varasláibehádja devddii olles viesu go eadni láibbui láibbiid.,Lukta av nybrakt brød fylte hele huset da mor bakte brød.,,,,
viessu,,hus,,N,A1,,,viesus,Sg.Loc,Áhku viesus lea unna beatnagaš mainna láven stoahkat.,I huset til bestemor er det en liten hund som jeg bruker å leke med.,,,,
viessu,,hus,,N,A1,,,vissui,Sg.Ill,"Go bohten vissui, de jerren eatnis: “Gos bat Biret lea?”","Da jeg kom inn I huset, spurte jeg mamma: “Hvor hen er Biret?”",,,,
biila,,bil,,N,A2,,,biillain,Sg.Com,Mii vuoddjáimet guvttiin biillain gávpogii iđđedis diibmu gávcci.,Vi kjørte med to biler til byen på morgenen klokken åtte.,,,,
biila,,bil,,N,A2,,,biillain,Pl.Loc,"Heasttat eai orron ballamin biillain ja olbmuin, muhto guhto ráfálaččat giettis.","Hestene syntes ikke å være redd for bilene og menneskene, men de beitet fredelig i enga.",,,,
biila,,bil,,N,A2,,,biillaiguin,Pl.Com,"Ollugat vudje priváhta biillaiguin, muhto mii leimmet maiddái láigohan busse.","Mange kjørte med private biler, men vi hadde også leid buss.",,,,
eadni,,mor,,N,A1,,,eatni,Sg.Acc,Elle buorrestii eatni ovdal go vázzilii skuvlii.,Elle ga mor en klem før hun gikk til skolen.,,,,
eadni,,mor,,N,A1,,,eatni,Sg.Gen,"Unna mánážat dulbmet eatni askki, stuora mánát dulbmet fas váimmu.","Små barn tråkker på mors fang, store barn tråkker på hjertet.",,,,
eadni,,mor,,N,A1,,,eadni,Sg.Nom,Eadni finai rambuvrris mielkki oastime.,Mor var innom butikken for å kjøpe melk.,,,,
